{
  "schemaVersion": "1.0",
  "kind": "loopengineer.watcherDecision",
  "decision_id": "watcher-decision-19-grant",
  "decision_type": "grant_channel",
  "version": {
    "productVersion": "0.1.0",
    "protocolVersion": "1",
    "schemaVersion": "1.0",
    "skillContractVersion": "1"
  },
  "watcher_id": "watcher-19",
  "target_channel_id": "channel-contract",
  "target_scheduler_id": "scheduler-19",
  "created_at": "2026-06-15T09:30:00Z",
  "inputs": [
    {
      "kind": "file",
      "locator": ".loopengineer/state/issue-19/channel-state.json",
      "consumed": true
    },
    {
      "kind": "github",
      "locator": "https://github.com/MC-and-his-Agents/LoopEngineer/issues/19",
      "consumed": true
    }
  ],
  "rationale": "No active owner conflicts with the requested contract schema paths.",
  "next_action": {
    "owner": "scheduler",
    "action": "use granted channel and report release evidence",
    "status": "required"
  }
}
